{
  "composition_id": "WhyExplainerMVP",
  "project_id": "why_ryokan_small_dishes_001",
  "domain_category": "travel_and_culture",
  "title": "为什么日本温泉旅馆的晚餐常常是一小碟一小碟？",
  "ready_for_final_render": false,
  "blocking_reasons": [
    "SC-002: Missing high-confidence asset (status=NEEDS_HUMAN_ASSET). Reason: 【缺素材 NEEDS_HUMAN_ASSET】当前 asset-index.json 中缺少『十几个小碗小碟+小火锅俯拍』高置信度实拍视频，严禁随机配图，需人工补齐合法实拍素材。",
    "SC-006: Low-confidence asset (null, score=0.52) requires human verification.",
    "SC-007: Missing high-confidence asset (status=NEEDS_HUMAN_ASSET). Reason: 【缺素材 NEEDS_HUMAN_ASSET + 60秒防重拦截】asset-index.json 中无后厨摆放小碟实拍视频；且 AST-VID-001 已在 48.5 秒前（SC-001）使用过，受『同一素材60秒内不得重复使用』规则约束，不可复用 AST-VID-001，故标记为待人工补素材。"
  ],
  "video_config": {
    "fps": 30,
    "width": 1920,
    "height": 1080,
    "duration_in_frames": 1920,
    "duration_ms": 64000,
    "duration_sec": 64,
    "safe_margin_px": {
      "top": 72,
      "bottom": 96,
      "left": 96,
      "right": 96
    },
    "theme_palette": {
      "background": "#0F1419",
      "primary_text": "#F3F4F6",
      "accent": "#F59E0B",
      "muted_text": "#9CA3AF",
      "danger": "#EF4444",
      "warning": "#F97316"
    }
  },
  "audio_track": {
    "src": "audio/narration.wav",
    "start_from_frame": 0,
    "end_at_frame": 1920,
    "duration_ms": 64000,
    "volume": 1,
    "unauthorized_bgm_present": false
  },
  "caption_track": {
    "srt_src": "captions/captions.srt",
    "safe_bottom_margin_px": 96,
    "max_chars_per_line": 22,
    "captions": [
      {
        "index": 1,
        "start_ms": 0,
        "end_ms": 8000,
        "from_frame": 0,
        "duration_in_frames": 240,
        "text": "住进传统温泉旅馆，晚餐往往先让人吃惊：",
        "char_count": 19
      },
      {
        "index": 2,
        "start_ms": 8000,
        "end_ms": 16500,
        "from_frame": 240,
        "duration_in_frames": 255,
        "text": "桌上摆满十几个小碗、小碟和小火锅。",
        "char_count": 17
      },
      {
        "index": 3,
        "start_ms": 16500,
        "end_ms": 24000,
        "from_frame": 495,
        "duration_in_frames": 225,
        "text": "每一份都不多，",
        "char_count": 7
      },
      {
        "index": 4,
        "start_ms": 24000,
        "end_ms": 32500,
        "from_frame": 720,
        "duration_in_frames": 255,
        "text": "却像把一顿饭拆成了一场小型展览。",
        "char_count": 16
      },
      {
        "index": 5,
        "start_ms": 32500,
        "end_ms": 40000,
        "from_frame": 975,
        "duration_in_frames": 225,
        "text": "这并不只是为了好看，",
        "char_count": 10
      },
      {
        "index": 6,
        "start_ms": 40000,
        "end_ms": 48500,
        "from_frame": 1200,
        "duration_in_frames": 255,
        "text": "它同时来自宴席传统、料理节奏和旅馆的服务方式。",
        "char_count": 23
      },
      {
        "index": 7,
        "start_ms": 48500,
        "end_ms": 56000,
        "from_frame": 1455,
        "duration_in_frames": 225,
        "text": "接下来，我们就从这些小碟子开始，",
        "char_count": 16
      },
      {
        "index": 8,
        "start_ms": 56000,
        "end_ms": 64000,
        "from_frame": 1680,
        "duration_in_frames": 240,
        "text": "拆开看一顿温泉旅馆晚餐的历史。",
        "char_count": 15
      }
    ]
  },
  "timeline_tracks": [
    {
      "scene_id": "SC-001",
      "chapter_ref": "opening_part_1",
      "is_final_ending": false,
      "start_ms": 0,
      "end_ms": 8000,
      "from_frame": 0,
      "duration_in_frames": 240,
      "visual_type": "broll_video",
      "scene_type": "broll_video",
      "status": "READY_PLACEHOLDER",
      "render_mode": "internal_placeholder_media_asset",
      "narration_text": "住进传统温泉旅馆，晚餐往往先让人吃惊：",
      "visual_purpose": "建立传统日式温泉旅馆（Ryokan）榻榻米客房或用餐包间的空间感，镜头从推开障子门缓慢推进至矮桌，营造第一眼看到满桌料理前的视觉期待。",
      "human_review_required": false,
      "review_status": "approved_by_user",
      "review_reason": "涉及日本传统建筑与地域文化场景，且当前使用 internal_placeholder 占位视频，需人工确认是否替换为实拍素材。",
      "confidence_score": 0.85,
      "search_queries_zh": [
        "日本传统温泉旅馆榻榻米房间实拍",
        "日式旅馆和室矮桌晚餐准备镜头"
      ],
      "search_queries_en": [
        "traditional Japanese ryokan tatami room interior broll",
        "ryokan dining table preparation sliding shoji door"
      ],
      "must_show": [
        "传统日式和室榻榻米与木质矮桌环境",
        "克制温和的室内暖光氛围"
      ],
      "must_not_show": [
        "现代西式自助餐厅或快餐店画面",
        "未经授权的日本旅游综艺节目台标或截图"
      ],
      "fallback": {
        "fallback_scene_type": "kinetic_text",
        "component_spec": "深色背景动态浮现开篇提问：『传统温泉旅馆的晚餐，为什么总让人第一眼吃惊？』"
      },
      "approved_asset": {
        "asset_id": "AST-VID-001",
        "src": "assets/video/placeholder_ryokan_table_broll.mp4",
        "type": "video",
        "resolution": "1920x1080",
        "duration_seconds": 9,
        "license_status": "internal_placeholder",
        "crop_mode": "full_frame_slow_push",
        "confidence_score": 0.85
      },
      "procedural_props": {
        "badge_label": "OPENING · 空间与问题切入",
        "headline": "传统温泉旅馆的晚餐，为什么总让人第一眼吃惊？",
        "subheadline": "建立传统日式和室榻榻米与木质矮桌环境",
        "fallback_scene_type": "kinetic_text",
        "component_spec": "深色背景动态浮现开篇提问：『传统温泉旅馆的晚餐，为什么总让人第一眼吃惊？』",
        "items": [
          "一泊二食（含早晚餐住宿）的核心体验场景",
          "从推开障子门到看见满桌器皿的第一视觉反差"
        ],
        "nodes": []
      },
      "transition": {
        "in": "fade_from_black",
        "out": "cut",
        "duration_frames": 15
      }
    },
    {
      "scene_id": "SC-002",
      "chapter_ref": "opening_part_2",
      "is_final_ending": false,
      "start_ms": 8000,
      "end_ms": 16500,
      "from_frame": 240,
      "duration_in_frames": 255,
      "visual_type": "kinetic_text",
      "scene_type": "broll_video",
      "status": "READY_PROCEDURAL",
      "render_mode": "placeholder_awaiting_human_asset",
      "narration_text": "桌上摆满十几个小碗、小碟和小火锅。",
      "visual_purpose": "采用90度垂直俯拍（Top-Down）视角，完整展示一张摆满12至15个不同材质小碗、小钵、漆器碟与单人陶锅的温泉旅馆晚餐桌面，通过器物数量形成强烈的视觉冲击。",
      "human_review_required": false,
      "review_status": "approved_by_user",
      "review_reason": "【缺素材 NEEDS_HUMAN_ASSET】当前 asset-index.json 中缺少『十几个小碗小碟+小火锅俯拍』高置信度实拍视频，严禁随机配图，需人工补齐合法实拍素材。",
      "confidence_score": 0,
      "search_queries_zh": [
        "日本温泉旅馆一泊二食晚餐俯拍全貌",
        "日式会席料理十几个小碟子和小火锅桌面特写",
        "日本旅馆桌膳小钵小碗阵列实拍"
      ],
      "search_queries_en": [
        "overhead shot Japanese ryokan kaiseki dinner many small dishes",
        "top down view traditional ryokan meal small bowls and mini hotpot",
        "dozens of small ceramic plates Japanese inn dinner table"
      ],
      "must_show": [
        "同一张桌面上摆满十几个小碗、小碟与单人小火锅（固形燃料陶锅）",
        "清晰的器皿分布俯视或斜俯视构图"
      ],
      "must_not_show": [
        "中式大圆桌转盘合菜",
        "只有一碗拉面或单盘咖喱饭的简餐画面"
      ],
      "fallback": {
        "fallback_scene_type": "data_card",
        "component_spec": "桌面器物网格拆解卡：绘制『1张膳盘 = 12~15件微型器皿（先付小钵、刺身猪口、盖物碗、单人小锅、香物浅碟）』。"
      },
      "approved_asset": null,
      "procedural_props": {
        "badge_label": "KINETIC_TEXT · opening_part_2",
        "headline": "桌上摆满十几个小碗、小碟和小火锅。",
        "subheadline": "采用90度垂直俯拍（Top-Down）视角，完整展示一张摆满12至15个不同材质小碗、小钵、漆器碟与...",
        "fallback_scene_type": "data_card",
        "component_spec": "桌面器物网格拆解卡：绘制『1张膳盘 = 12~15件微型器皿（先付小钵、刺身猪口、盖物碗、单人小锅、香物浅碟）』。",
        "items": [
          "同一张桌面上摆满十几个小碗、小碟与单人小火锅（固形燃料陶锅）",
          "清晰的器皿分布俯视或斜俯视构图"
        ],
        "nodes": []
      },
      "transition": {
        "in": "cut",
        "out": "cross_dissolve",
        "duration_frames": 12
      }
    },
    {
      "scene_id": "SC-003",
      "chapter_ref": "body_exhibition_part_1",
      "is_final_ending": false,
      "start_ms": 16500,
      "end_ms": 24000,
      "from_frame": 495,
      "duration_in_frames": 225,
      "visual_type": "photo_motion",
      "scene_type": "photo_motion",
      "status": "READY_PLACEHOLDER",
      "render_mode": "internal_placeholder_media_asset",
      "narration_text": "每一份都不多，",
      "visual_purpose": "通过静态高分辨率图片配合缓慢推进动效（photo_motion），聚焦单只小碟中仅放两三片刺身或一撮时令山菜的留白比例，直观体现『单碟分量极小、器皿留白极多』的特征。",
      "human_review_required": false,
      "review_status": "approved_by_user",
      "review_reason": "日常器皿分量视觉说明，使用合规 internal_placeholder 静态图，无敏感历史或人物声明。",
      "confidence_score": 0.88,
      "search_queries_zh": [
        "日式小钵料理微小分量特写照片",
        "怀石料理单碟两片生鱼片留白构图"
      ],
      "search_queries_en": [
        "close up tiny portion Japanese kobachi small dish",
        "minimalist food plating small ceramic saucer kaiseki"
      ],
      "must_show": [
        "单只小碟内精致微量的食物与显著器皿留白",
        "微距静物质感"
      ],
      "must_not_show": [
        "堆成小山的大盘大碗分量",
        "带有餐厅宣传促销文字的海报图"
      ],
      "fallback": {
        "fallback_scene_type": "data_card",
        "component_spec": "单碟容量对比卡：『单碟净重约 15g–40g（仅一至两口分量）× 12~15道 = 完整饱腹感』。"
      },
      "approved_asset": {
        "asset_id": "AST-IMG-001",
        "src": "assets/images/placeholder_kaiseki_trays.png",
        "type": "image",
        "resolution": "1920x1080",
        "duration_seconds": null,
        "license_status": "internal_placeholder",
        "crop_mode": "ken_burns_zoom_in_center",
        "confidence_score": 0.88
      },
      "procedural_props": {
        "badge_label": "PORTION SCALE · 微量分装特征",
        "headline": "单碟仅一至两口分量，器皿留白超过 60%",
        "subheadline": "以微量多品种替代单一大量装盘",
        "fallback_scene_type": "data_card",
        "component_spec": "单碟容量对比卡：『单碟净重约 15g–40g（仅一至两口分量）× 12~15道 = 完整饱腹感』。",
        "items": [
          "单碟净重通常仅 15g–40g，强调食材局部截面与色泽",
          "12–15 道微量料理累计达成完整正餐热量与饱腹感"
        ],
        "nodes": []
      },
      "transition": {
        "in": "cross_dissolve",
        "out": "cut",
        "duration_frames": 10
      }
    },
    {
      "scene_id": "SC-004",
      "chapter_ref": "body_exhibition_part_2",
      "is_final_ending": false,
      "start_ms": 24000,
      "end_ms": 32500,
      "from_frame": 720,
      "duration_in_frames": 255,
      "visual_type": "kinetic_text",
      "scene_type": "kinetic_text",